{
  "schema": 1,
  "environment": "production",
  "secret_root": "/etc/vps/secrets",
  "observed_at": "2026-08-23T14:45:12Z",
  "controller_revision": "891a898074314104e5bfacf78e46cdf512b7e5c5",
  "evidence": "read-only-secret-metadata-audit",
  "value_recovery_state": "not-configured",
  "secrets": [
    {
      "id": "monflorian.openai-api-key",
      "scope": "monflorian",
      "classification": "secret",
      "provider": "openai",
      "path": "/etc/vps/secrets/monflorian/monflorian-openai-api-key",
      "owner": 0,
      "group": 10001,
      "mode": "0440",
      "materializer": "ansible-deploy-role",
      "consumers": ["monflorian-backend"],
      "source": "provider-secret",
      "rebuild": "restore-from-external-store",
      "declared_state": "planned",
      "generation": 0,
      "target_generation": 1,
      "generation_binding": "unlinked",
      "host_state": "absent",
      "provider_state": "planned"
    },
    {
      "id": "monflorian.smtp-password",
      "scope": "monflorian",
      "classification": "secret",
      "provider": "scaleway-tem",
      "credential_set": "scaleway-tem:monflorian-prod-smtp",
      "permission_set": "TransactionalEmailEmailSmtpCreate",
      "path": "/etc/vps/secrets/monflorian/monflorian-smtp-password",
      "owner": 0,
      "group": 10001,
      "mode": "0440",
      "materializer": "not-implemented",
      "consumers": ["monflorian-backend"],
      "source": "provider-secret",
      "rebuild": "restore-from-external-store",
      "declared_state": "planned",
      "generation": 0,
      "target_generation": 1,
      "generation_binding": "unlinked",
      "host_state": "absent",
      "provider_state": "planned"
    },
    {
      "id": "monflorian.smtp-username",
      "scope": "monflorian",
      "classification": "protected-input",
      "provider": "scaleway-tem",
      "credential_set": "scaleway-tem:monflorian-prod-smtp",
      "permission_set": "TransactionalEmailEmailSmtpCreate",
      "path": "/etc/vps/secrets/monflorian/monflorian-smtp-username",
      "owner": 0,
      "group": 10001,
      "mode": "0440",
      "materializer": "not-implemented",
      "consumers": ["monflorian-backend"],
      "source": "provider-identifier",
      "rebuild": "restore-from-external-store",
      "declared_state": "planned",
      "generation": 0,
      "target_generation": 1,
      "generation_binding": "unlinked",
      "host_state": "absent",
      "provider_state": "planned"
    },
    {
      "id": "parkventory.oidc-client-secret",
      "scope": "parkventory",
      "classification": "secret",
      "provider": "auth0",
      "path": "/etc/vps/secrets/parkventory/parkventory-oidc-client-secret",
      "owner": 0,
      "group": 10001,
      "mode": "0440",
      "materializer": "not-implemented",
      "consumers": ["parkventory-backend"],
      "source": "provider-secret",
      "rebuild": "restore-from-external-store",
      "declared_state": "planned",
      "generation": 0,
      "target_generation": 1,
      "generation_binding": "unlinked",
      "host_state": "absent",
      "provider_state": "planned"
    },
    {
      "id": "parkventory.oidc-state-secret",
      "scope": "parkventory",
      "classification": "secret",
      "provider": "local",
      "path": "/etc/vps/secrets/parkventory/parkventory-oidc-state-secret",
      "owner": 0,
      "group": 10001,
      "mode": "0440",
      "materializer": "not-implemented",
      "consumers": ["parkventory-backend"],
      "source": "operator-file",
      "rebuild": "restore-from-external-store",
      "declared_state": "planned",
      "generation": 0,
      "target_generation": 1,
      "generation_binding": "unlinked",
      "host_state": "absent",
      "provider_state": "not-applicable"
    },
    {
      "id": "parkventory.oidc-token-encryption-secret",
      "scope": "parkventory",
      "classification": "secret",
      "provider": "local",
      "path": "/etc/vps/secrets/parkventory/parkventory-oidc-token-encryption-secret",
      "owner": 0,
      "group": 10001,
      "mode": "0440",
      "materializer": "not-implemented",
      "consumers": ["parkventory-backend"],
      "source": "operator-file",
      "rebuild": "restore-from-external-store",
      "declared_state": "planned",
      "generation": 0,
      "target_generation": 1,
      "generation_binding": "unlinked",
      "host_state": "absent",
      "provider_state": "not-applicable"
    },
    {
      "id": "parkventory.postgres-migrator-password",
      "scope": "parkventory",
      "classification": "secret",
      "provider": "local",
      "path": "/etc/vps/secrets/parkventory/parkventory-postgres-migrator-password",
      "owner": 0,
      "group": 10001,
      "mode": "0440",
      "materializer": "materialize-parkventory-secrets",
      "consumers": ["parkventory-migrator"],
      "source": "generated-on-atlas",
      "rebuild": "restore-from-external-store",
      "declared_state": "planned",
      "generation": 0,
      "target_generation": 1,
      "generation_binding": "unlinked",
      "host_state": "absent",
      "provider_state": "not-applicable"
    },
    {
      "id": "parkventory.postgres-runtime-password",
      "scope": "parkventory",
      "classification": "secret",
      "provider": "local",
      "path": "/etc/vps/secrets/parkventory/parkventory-postgres-runtime-password",
      "owner": 0,
      "group": 10001,
      "mode": "0440",
      "materializer": "materialize-parkventory-secrets",
      "consumers": ["parkventory-backend"],
      "source": "generated-on-atlas",
      "rebuild": "restore-from-external-store",
      "declared_state": "planned",
      "generation": 0,
      "target_generation": 1,
      "generation_binding": "unlinked",
      "host_state": "absent",
      "provider_state": "not-applicable"
    },
    {
      "id": "parkventory.smtp-password",
      "scope": "parkventory",
      "classification": "secret",
      "provider": "scaleway-tem",
      "credential_set": "scaleway-tem:parkventory-prod-smtp",
      "permission_set": "TransactionalEmailEmailSmtpCreate",
      "path": "/etc/vps/secrets/parkventory/parkventory-smtp-password",
      "owner": 0,
      "group": 10001,
      "mode": "0440",
      "materializer": "not-implemented",
      "consumers": ["parkventory-backend"],
      "source": "provider-secret",
      "rebuild": "restore-from-external-store",
      "declared_state": "planned",
      "generation": 0,
      "target_generation": 1,
      "generation_binding": "unlinked",
      "host_state": "absent",
      "provider_state": "planned"
    },
    {
      "id": "parkventory.smtp-username",
      "scope": "parkventory",
      "classification": "protected-input",
      "provider": "scaleway-tem",
      "credential_set": "scaleway-tem:parkventory-prod-smtp",
      "permission_set": "TransactionalEmailEmailSmtpCreate",
      "path": "/etc/vps/secrets/parkventory/parkventory-smtp-username",
      "owner": 0,
      "group": 10001,
      "mode": "0440",
      "materializer": "not-implemented",
      "consumers": ["parkventory-backend"],
      "source": "provider-identifier",
      "rebuild": "restore-from-external-store",
      "declared_state": "planned",
      "generation": 0,
      "target_generation": 1,
      "generation_binding": "unlinked",
      "host_state": "absent",
      "provider_state": "planned"
    },
    {
      "id": "platform.grafana-admin-password",
      "scope": "platform",
      "classification": "secret",
      "provider": "local",
      "path": "/etc/vps/secrets/platform/grafana-admin-password",
      "owner": 0,
      "group": 472,
      "mode": "0440",
      "materializer": "materialize-internal-platform-secrets",
      "consumers": ["grafana"],
      "source": "generated-on-atlas",
      "rebuild": "restore-from-external-store",
      "declared_state": "required",
      "generation": 0,
      "target_generation": 1,
      "generation_binding": "unlinked",
      "host_state": "materialized",
      "provider_state": "not-applicable"
    },
    {
      "id": "platform.grafana-secret-key",
      "scope": "platform",
      "classification": "secret",
      "provider": "local",
      "path": "/etc/vps/secrets/platform/grafana-secret-key",
      "owner": 0,
      "group": 472,
      "mode": "0440",
      "materializer": "materialize-internal-platform-secrets",
      "consumers": ["grafana"],
      "source": "generated-on-atlas",
      "rebuild": "restore-from-external-store",
      "declared_state": "required",
      "generation": 0,
      "target_generation": 1,
      "generation_binding": "unlinked",
      "host_state": "materialized",
      "provider_state": "not-applicable"
    },
    {
      "id": "platform.postgres-exporter-password",
      "scope": "platform",
      "classification": "secret",
      "provider": "local",
      "path": "/etc/vps/secrets/platform/postgres-exporter-password",
      "owner": 0,
      "group": 70,
      "mode": "0440",
      "materializer": "materialize-internal-platform-secrets",
      "consumers": ["postgres-exporter", "postgresql"],
      "source": "generated-on-atlas",
      "rebuild": "restore-from-external-store",
      "declared_state": "required",
      "generation": 0,
      "target_generation": 1,
      "generation_binding": "unlinked",
      "host_state": "materialized",
      "provider_state": "not-applicable"
    },
    {
      "id": "platform.postgres-superuser-password",
      "scope": "platform",
      "classification": "secret",
      "provider": "local",
      "path": "/etc/vps/secrets/platform/postgres-superuser-password",
      "owner": 0,
      "group": 70,
      "mode": "0440",
      "materializer": "materialize-internal-platform-secrets",
      "consumers": ["postgresql"],
      "source": "generated-on-atlas",
      "rebuild": "restore-from-external-store",
      "declared_state": "required",
      "generation": 0,
      "target_generation": 1,
      "generation_binding": "unlinked",